{
  "id": "kairos-white-2027-front",
  "slug": "kairos-white-2027-front",
  "path": "assets/uniforms/2027/kairos/white/front.png",
  "mimeType": "image/png",
  "organizationId": "kairos-esports",
  "season": 2027,
  "category": "uniform",
  "orientation": "front",
  "color": "white",
  "canonStatus": "confirmed",
  "teamIds": [
    "kairos-lol-academy-white"
  ],
  "source": "user-approved-generated-asset",
  "importDate": "2026-10-30",
  "width": 1400,
  "height": 1400,
  "sha256": "1d06281b0b5a610d3da80d305d1ae765c1cb6ed45deb48e4c08e67dfe0b6f88b",
  "referencePath": "assets/uniforms/2027/references/white-front.png",
  "referenceSha256": "b91cfdbc43e6d9bb57fe7edc98380ebad278d266729bf3a1d504680fdb533dd3",
  "processing": "image-generator-reference-reconstruction-and-transparent-padding",
  "garmentHeight": 1154,
  "notes": [
    "Reconstructed from the approved reference to remove adjacent garments and restore clipped edges.",
    "Transparent margins normalized to a 1400px square without enlarging the generated artwork.",
    "Generated reconstruction, not a pixel-identical original or a new uniform design."
  ]
}
